{
  "call": {
    "asset": "ZONE-01",
    "building_id": "demo-building-001",
    "decision_time": "2026-01-15T07:00:00Z",
    "operation": "set_zone_setpoint",
    "parameter": "setpoint_c",
    "schema": "ot-normalized-call/v1",
    "unit": "degC",
    "value": 20.5
  },
  "case_id": "af-1-valid",
  "construction": "owner grants operator ZONE-01 and ZONE-02; operator grants agent ZONE-01 until 18:00; call ZONE-01 at 07:00, 20.5 degC",
  "delegation": [
    {
      "authority": {
        "depth": {
          "remaining": 1
        },
        "reputation": {
          "ceiling": 100,
          "profile": "aps-score-0-100-v1"
        },
        "reversibility": {
          "ceiling": "compensable",
          "profile": "aps-tci-v1"
        },
        "scope": {
          "grants": [
            "ot:demo-building-001:ZONE-01:setpoint_c:set_zone_setpoint",
            "ot:demo-building-001:ZONE-02:setpoint_c:set_zone_setpoint"
          ],
          "profile": "aps-hierarchical-v1"
        },
        "spend": {
          "mode": "unbounded"
        },
        "time": {
          "not_after": "2026-01-15T23:59:59.000Z",
          "not_before": "2026-01-15T00:00:00.000Z"
        },
        "values": {
          "profile": "aps-values-identifiers-v1",
          "required": []
        }
      },
      "delegation_id": "sha256:f43dde8e67b14e50635081677fff04e08412402611aa1fab287ddeccbfac9b4d",
      "issued_at": "2026-01-15T00:00:00.000Z",
      "issuer": "aps-test:building-owner",
      "nonce": "4683832339816af75723b7ce780fdabe",
      "parent_delegation_id": null,
      "record_type": "aps:authority-delegation:v1",
      "signature": "42a429463f8ac762eb8f00792e7f3de15abe5adfa0f404e755e89fa2a7e3e136853b5bf120a3ecc32e0e58f581627f9a755ed00b3ae9cfb31467f146e51e6909",
      "subject": "aps-test:operator",
      "verification_method": "aps-test:building-owner#key-1",
      "version": "1.0"
    },
    {
      "authority": {
        "depth": {
          "remaining": 0
        },
        "reputation": {
          "ceiling": 100,
          "profile": "aps-score-0-100-v1"
        },
        "reversibility": {
          "ceiling": "compensable",
          "profile": "aps-tci-v1"
        },
        "scope": {
          "grants": [
            "ot:demo-building-001:ZONE-01:setpoint_c:set_zone_setpoint"
          ],
          "profile": "aps-hierarchical-v1"
        },
        "spend": {
          "mode": "unbounded"
        },
        "time": {
          "not_after": "2026-01-15T18:00:00.000Z",
          "not_before": "2026-01-15T00:00:00.000Z"
        },
        "values": {
          "profile": "aps-values-identifiers-v1",
          "required": []
        }
      },
      "delegation_id": "sha256:f5cbee1f860f7f58423b2ccdecb4143143dc816942763dc32cebdeb3a3cedd6e",
      "issued_at": "2026-01-15T00:00:00.000Z",
      "issuer": "aps-test:operator",
      "nonce": "dd3ecc803f2382f2deb50f7e821da4ba",
      "parent_delegation_id": "sha256:f43dde8e67b14e50635081677fff04e08412402611aa1fab287ddeccbfac9b4d",
      "record_type": "aps:authority-delegation:v1",
      "signature": "5b8ec5b73dff514a9357ce07579783b9d9b718c9c00fae4309400751e289e023570f8e73e42c2fe69208f1916a8abdadd3241d92f53af740daaf56f62d86cc04",
      "subject": "aps-test:agent",
      "verification_method": "aps-test:operator#key-1",
      "version": "1.0"
    }
  ],
  "schema": "ot-authority-case/v1",
  "work_order": {
    "asset": "ZONE-01",
    "building_id": "demo-building-001",
    "delegation_id": "sha256:f5cbee1f860f7f58423b2ccdecb4143143dc816942763dc32cebdeb3a3cedd6e",
    "delegation_sha256": "7987d427c75a66002563959bafe1bbae9092242457e2578cfd1332d985ce38fe",
    "issuer": "testbed-test-key-1",
    "operation": "set_zone_setpoint",
    "parameter": "setpoint_c",
    "schema": "ot-work-order/v1",
    "signature": "oMPpeaTBHQFP44K074Jheq9H7ErWoU2ZJkkAzV5Pcz6dx0dNgJgI0RtsM8ZOliMBQHPdPcJ4P2VHj_9xhXjjDg",
    "valid_from": "2026-01-15T00:00:00Z",
    "valid_until": "2026-01-15T23:59:59Z",
    "value_range": {
      "max": 21.0,
      "min": 19.0,
      "unit": "degC"
    },
    "work_order_id": "WO-af-1-valid"
  }
}
